{
  "namespace": "cvss",
  "key": "MA",
  "version": "2.0.0",
  "name": "Modified Availability Impact",
  "definition": "This metric measures the impact to availability of a successfully exploited vulnerability.",
  "schemaVersion": "2.0.0",
  "values": [
    {
      "key": "N",
      "name": "None",
      "definition": "There is no impact to the availability of the system."
    },
    {
      "key": "L",
      "name": "Low",
      "definition": "There is reduced performance or interruptions in resource availability."
    },
    {
      "key": "H",
      "name": "High",
      "definition": "There is total loss of availability, resulting in the attacker being able to fully deny access to resources in the impacted component; this loss is either sustained (while the attacker continues to deliver the attack) or persistent (the condition persists even after the attack has completed)."
    },
    {
      "key": "X",
      "name": "Not Defined",
      "definition": "This metric value is not defined. See CVSS documentation for details."
    }
  ]
}
