{
  "namespace": "cvss",
  "key": "E",
  "version": "1.1.0",
  "name": "Exploitability",
  "definition": "This metric measures the current state of exploit technique or code availability and suggests a likelihood of exploitation.",
  "schemaVersion": "2.0.0",
  "values": [
    {
      "key": "U",
      "name": "Unproven",
      "definition": "No exploit code is yet available or an exploit method is entirely theoretical."
    },
    {
      "key": "P",
      "name": "Proof of Concept",
      "definition": "Proof of concept exploit code or an attack demonstration that is not practically applicable to deployed systems is available. The code or technique is not functional in all situations and may require substantial hand tuning by a skilled attacker for use against deployed systems."
    },
    {
      "key": "F",
      "name": "Functional",
      "definition": "Functional exploit code is available. The code works in most situations where the vulnerability is exploitable."
    },
    {
      "key": "H",
      "name": "High",
      "definition": "Either the vulnerability is exploitable by functional mobile autonomous code or no exploit is required (manual trigger) and the details for the manual technique are widely available. The code works in every situation where the vulnerability is exploitable and/or is actively being delivered via a mobile autonomous agent (a worm or virus)."
    },
    {
      "key": "ND",
      "name": "Not Defined",
      "definition": "This metric value is not defined. See CVSS documentation for details."
    }
  ]
}
