{
  "namespace": "cvss",
  "key": "AR",
  "version": "1.1.0",
  "name": "Availability Requirement",
  "definition": "This metric measures the impact to the availability of a successfully exploited vulnerability.",
  "schemaVersion": "2.0.0",
  "values": [
    {
      "key": "L",
      "name": "Low",
      "definition": "Loss of availability is likely to have only a limited adverse effect on the organization or individuals associated with the organization (e.g., employees, customers)."
    },
    {
      "key": "M",
      "name": "Medium",
      "definition": "Loss of availability is likely to have a serious adverse effect on the organization or individuals associated with the organization (e.g., employees, customers)."
    },
    {
      "key": "H",
      "name": "High",
      "definition": "Loss of availability is likely to have a catastrophic adverse effect on the organization or individuals associated with the organization (e.g., employees, customers)."
    },
    {
      "key": "X",
      "name": "Not Defined",
      "definition": "This metric value is not defined. See CVSS documentation for details."
    }
  ]
}
