{
  "namespace": "cvss",
  "key": "AC",
  "version": "3.0.0",
  "name": "Attack Complexity",
  "definition": "This metric describes the conditions beyond the attacker's control that must exist in order to exploit the vulnerability.",
  "schemaVersion": "2.0.0",
  "values": [
    {
      "key": "H",
      "name": "High",
      "definition": "A successful attack depends on conditions beyond the attacker's control."
    },
    {
      "key": "L",
      "name": "Low",
      "definition": "Specialized access conditions or extenuating circumstances do not exist. An attacker can expect repeatable success against the vulnerable component."
    }
  ]
}
