{
  "namespace": "x_org.owasp#aivss",
  "key": "SI",
  "version": "1.0.0",
  "name": "Systemic Impact",
  "definition": "Measures the mission-criticality and blast radius of the systems, data, and processes the agent can affect.",
  "schemaVersion": "2.0.0",
  "values": [
    {
      "key": "C",
      "name": "Contained",
      "definition": "The impact of a compromise is limited to the agent itself, a single user's data, or a non-critical system. The business or mission impact is negligible."
    },
    {
      "key": "S",
      "name": "Significant",
      "definition": "A compromise would impact a major business function, a critical internal system, or cause cascading failures within a business unit. It could result in moderate financial loss, reputational damage, or operational disruption."
    },
    {
      "key": "R",
      "name": "Critical",
      "definition": "A compromise would pose a threat to the entire organization's viability, public safety, or critical infrastructure. It could lead to severe financial loss, widespread data breach, regulatory failure, or physical harm."
    }
  ]
}
