{
  "namespace": "cisa#nciss",
  "key": "FI",
  "version": "1.0.0",
  "name": "Functional Impact",
  "definition": "A measure of the impact to business functionality or ability to provide services.",
  "schemaVersion": "2.0.0",
  "values": [
    {
      "key": "N",
      "name": "No Impact",
      "definition": "Organization has experienced no loss in ability to provide all services to all users."
    },
    {
      "key": "L",
      "name": "Low",
      "definition": "Organization has experienced a loss of efficiency, but can still provide all critical services to all users with minimal effect on performance."
    },
    {
      "key": "M",
      "name": "Medium",
      "definition": "Organization has lost the ability to provide a critical service to a subset of system users."
    },
    {
      "key": "H",
      "name": "High",
      "definition": "Organization has lost the ability to provide all critical services to all system users."
    }
  ]
}
