{
  "namespace": "cvss",
  "key": "CR",
  "version": "1.1.1",
  "name": "Confidentiality Requirement",
  "definition": "This metric enables the consumer to customize the assessment depending on the importance of the affected IT asset to the analystâ€™s organization, measured in terms of Confidentiality.",
  "schemaVersion": "2.0.0",
  "values": [
    {
      "key": "L",
      "name": "Low",
      "definition": "Loss of confidentiality is likely to have only a limited adverse effect on the organization or individuals associated with the organization (e.g., employees, customers)."
    },
    {
      "key": "M",
      "name": "Medium",
      "definition": "Loss of confidentiality is likely to have a serious adverse effect on the organization or individuals associated with the organization (e.g., employees, customers)."
    },
    {
      "key": "H",
      "name": "High",
      "definition": "Loss of confidentiality is likely to have a catastrophic adverse effect on the organization or individuals associated with the organization (e.g., employees, customers)."
    },
    {
      "key": "X",
      "name": "Not Defined",
      "definition": "This metric value is not defined. See CVSS documentation for details."
    }
  ]
}
