{
  "namespace": "cvss",
  "key": "AU",
  "version": "1.0.0",
  "name": "Automatable",
  "definition": "The \"Automatable\" metric captures the answer to the question \"Can an attacker automate exploitation events for this vulnerability across multiple targets?\" based on steps 1-4 of the kill chain.",
  "schemaVersion": "2.0.0",
  "values": [
    {
      "key": "N",
      "name": "No",
      "definition": "Attackers cannot reliably automate all 4 steps of the kill chain for this vulnerability for some reason. These steps are reconnaissance, weaponization, delivery, and exploitation."
    },
    {
      "key": "Y",
      "name": "Yes",
      "definition": "Attackers can reliably automate all 4 steps of the kill chain. These steps are reconnaissance, weaponization, delivery, and exploitation (e.g., the vulnerability is \"wormable\")."
    },
    {
      "key": "X",
      "name": "Not Defined",
      "definition": "This metric value is not defined. See CVSS documentation for details."
    }
  ]
}
