{
  "namespace": "cvss",
  "key": "AT",
  "version": "1.0.0",
  "name": "Attack Requirements",
  "definition": "This metric captures the prerequisite deployment and execution conditions or variables of the vulnerable system that enable the attack.",
  "schemaVersion": "2.0.0",
  "values": [
    {
      "key": "P",
      "name": "Present",
      "definition": "The successful attack depends on the presence of specific deployment and execution conditions of the vulnerable system that enable the attack."
    },
    {
      "key": "N",
      "name": "None",
      "definition": "The successful attack does not depend on the deployment and execution conditions of the vulnerable system. The attacker can expect to be able to reach the vulnerability and execute the exploit under all or most instances of the vulnerability."
    }
  ]
}
