{
  "namespace": "cisa#nciss",
  "key": "FI",
  "version": "2.0.0",
  "name": "Functional Impact",
  "definition": "A measure of the impact to business functionality or ability to provide services.",
  "schemaVersion": "2.0.0",
  "values": [
    {
      "key": "N",
      "name": "No Impact",
      "definition": "Event has no impact."
    },
    {
      "key": "S",
      "name": "No Impact to Services",
      "definition": "Event has no impact to any business or Industrial Control Systems (ICS) services or delivery to entity customers."
    },
    {
      "key": "M",
      "name": "Minimal Impact to Non-Critical Services",
      "definition": "Some small level of impact to non-critical systems and services."
    },
    {
      "key": "C",
      "name": "Minimal Impact to Critical Services",
      "definition": "Minimal impact but to a critical system or service, such as email or active directory."
    },
    {
      "key": "I",
      "name": "Significant Impact to Non-Critical Services",
      "definition": "A non-critical service or system has a significant impact."
    },
    {
      "key": "D",
      "name": "Denial of Non-Critical Services",
      "definition": "A non-critical system is denied or destroyed."
    },
    {
      "key": "T",
      "name": "Significant Impact to Critical Services",
      "definition": "A critical system has a significant impact, such as local administrative account compromise."
    },
    {
      "key": "L",
      "name": "Denial of Critical Services/Loss of Control",
      "definition": "A critical system has been rendered unavailable."
    }
  ]
}
