{
  "namespace": "ssvc",
  "key": "HI",
  "version": "2.0.0",
  "name": "Human Impact",
  "definition": "Human Impact is a combination of Safety and Mission impacts.",
  "schemaVersion": "2.0.0",
  "values": [
    {
      "key": "L",
      "name": "Low",
      "definition": "Safety Impact:(None OR Minor) AND Mission Impact:(None OR Degraded OR Crippled)"
    },
    {
      "key": "M",
      "name": "Medium",
      "definition": "(Safety Impact:(None OR Minor) AND Mission Impact:MEF Failure) OR (Safety Impact:Major AND Mission Impact:(None OR Degraded OR Crippled))"
    },
    {
      "key": "H",
      "name": "High",
      "definition": "(Safety Impact:Hazardous AND Mission Impact:(None OR Degraded OR Crippled)) OR (Safety Impact:Major AND Mission Impact:MEF Failure)"
    },
    {
      "key": "VH",
      "name": "Very High",
      "definition": "Safety Impact:Catastrophic OR Mission Impact:Mission Failure"
    }
  ]
}
